move_key,name_en,name_es,type_key,category_key,power,accuracy,pp,priority,targeting_key,makes_contact,is_sound,is_pulse,is_punch,is_bite,is_slashing,is_status,effect_short_en,effect_short_es,effect_long_en,effect_long_es,source_key
focus_blast,Focus Blast,Focus Blast,fighting,special,120,70,5,,unknown,0,0,0,0,0,0,0,The user heightens its mental focus and unleashes its power. This may also lower the target's Sp. Def stat.,,The user heightens its mental focus and unleashes its power. This may also lower the target's Sp. Def stat.,,championslab
focus_energy,Focus Energy,Focus Energy,normal,status,,,30,,unknown,0,0,0,0,0,0,1,The user takes a deep breath and focuses so that its future attacks have a heightened chance of landing critical hits.,,The user takes a deep breath and focuses so that its future attacks have a heightened chance of landing critical hits.,,championslab
focus_punch,Focus Punch,Focus Punch,fighting,physical,150,100,20,,unknown,0,0,0,1,0,0,0,The user focuses its mind before launching a punch. This move fails if the user is hit before using the move.,,The user focuses its mind before launching a punch. This move fails if the user is hit before using the move.,,championslab
follow_me,Follow Me,Follow Me,normal,status,,,20,,unknown,0,0,0,0,0,0,1,"The user draws attention to itself, making all opposing Pokémon take aim only at the user.",,"The user draws attention to itself, making all opposing Pokémon take aim only at the user.",,championslab
forests_curse,Forest's Curse,Forest's Curse,grass,status,,100,20,,unknown,0,0,0,0,0,0,1,Gives the target the Forest Cursed status.,,Gives the target the Forest Cursed status.,,championslab
foul_play,Foul Play,Foul Play,dark,physical,95,100,15,,unknown,0,0,0,0,0,0,0,"The user turns the target's strength against it. The higher the target's Attack stat, the greater the damage this move inflicts.",,"The user turns the target's strength against it. The higher the target's Attack stat, the greater the damage this move inflicts.",,championslab
freeze_dry,Freeze-Dry,Freeze-Dry,ice,special,70,100,20,,unknown,0,0,0,0,0,0,0,The user rapidly cools the target. This may also leave the target frozen. This move is super effective on Water types.,,The user rapidly cools the target. This may also leave the target frozen. This move is super effective on Water types.,,championslab
frenzy_plant,Frenzy Plant,Frenzy Plant,grass,special,150,90,5,,unknown,0,0,0,0,0,0,0,The user slams the target with the roots of an enormous tree. The user can't move on the next turn.,,The user slams the target with the roots of an enormous tree. The user can't move on the next turn.,,championslab
frost_breath,Frost Breath,Frost Breath,ice,special,60,90,15,,unknown,0,0,0,0,0,0,0,Always a critical hit.,,Always a critical hit.,,championslab
frustration,Frustration,Frustration,normal,physical,,100,20,,unknown,0,0,0,0,0,0,0,An attack based on lack of loyalty.,,An attack based on lack of loyalty.,,championslab
future_sight,Future Sight,Future Sight,psychic,special,120,100,10,,unknown,0,0,0,0,0,0,0,"Two turns after this move is used, a hunk of psychic energy attacks the target.",,"Two turns after this move is used, a hunk of psychic energy attacks the target.",,championslab
gastro_acid,Gastro Acid,Gastro Acid,poison,status,,100,10,,unknown,0,0,0,0,0,0,1,The user hurls up its stomach acids on the target. The fluid eliminates the effect of the target's Ability.,,The user hurls up its stomach acids on the target. The fluid eliminates the effect of the target's Ability.,,championslab
giga_drain,Giga Drain,Giga Drain,grass,special,75,100,10,,unknown,0,0,0,0,0,0,0,A nutrient-draining attack. The user's HP is restored by up to half the damage taken by the target.,,A nutrient-draining attack. The user's HP is restored by up to half the damage taken by the target.,,championslab
giga_impact,Giga Impact,Giga Impact,normal,physical,150,90,5,,unknown,0,0,0,0,0,0,0,The user charges at the target using every bit of its power. The user can't move on the next turn.,,The user charges at the target using every bit of its power. The user can't move on the next turn.,,championslab
gigaton_hammer,Gigaton Hammer,Gigaton Hammer,steel,physical,160,100,5,,unknown,0,0,0,0,0,0,0,The user swings its whole body around to attack with its huge hammer. This move can't be used twice in a row.,,The user swings its whole body around to attack with its huge hammer. This move can't be used twice in a row.,,championslab
glare,Glare,Glare,normal,status,,100,20,,unknown,0,0,0,0,0,0,1,Paralyzes the target.,,Paralyzes the target.,,championslab
grass_knot,Grass Knot,Grass Knot,grass,special,,100,20,,unknown,0,0,0,0,0,0,0,"The user snares the target with grass and trips it. The heavier the target, the greater the move's power.",,"The user snares the target with grass and trips it. The heavier the target, the greater the move's power.",,championslab
grassy_glide,Grassy Glide,Grassy Glide,grass,physical,55,100,20,,unknown,0,0,0,0,0,0,0,"Gliding on the ground, the user attacks the target. This move always goes first on Grassy Terrain.",,"Gliding on the ground, the user attacks the target. This move always goes first on Grassy Terrain.",,championslab
grassy_terrain,Grassy Terrain,Grassy Terrain,grass,status,,,10,,unknown,0,0,0,0,0,0,1,The user turns the ground into Grassy Terrain for five turns. This restores the HP of Pokémon on the ground a little every turn and powers up Grass-type moves.,,The user turns the ground into Grassy Terrain for five turns. This restores the HP of Pokémon on the ground a little every turn and powers up Grass-type moves.,,championslab
grav_apple,Grav Apple,Grav Apple,grass,physical,90,100,10,,unknown,0,0,0,0,0,0,0,The user inflicts damage by dropping an apple from high above. This also lowers the target’s Defense stat.,,The user inflicts damage by dropping an apple from high above. This also lowers the target’s Defense stat.,,championslab
gravity,Gravity,Gravity,psychic,status,,,5,,unknown,0,0,0,0,0,0,1,Enables Flying types or Pokémon with the Levitate Ability to be hit by Ground-type moves for five turns. Moves that involve flying can't be used.,,Enables Flying types or Pokémon with the Levitate Ability to be hit by Ground-type moves for five turns. Moves that involve flying can't be used.,,championslab
growth,Growth,Growth,normal,status,,,20,,unknown,0,0,0,0,0,0,1,"The user's body grows all at once, boosting the Attack and Sp. Atk stats.",,"The user's body grows all at once, boosting the Attack and Sp. Atk stats.",,championslab
guard_split,Guard Split,Guard Split,psychic,status,,,10,,unknown,0,0,0,0,0,0,1,The user employs its psychic power to average its Defense and Sp. Def stats with those of the target.,,The user employs its psychic power to average its Defense and Sp. Def stats with those of the target.,,championslab
guard_swap,Guard Swap,Guard Swap,psychic,status,,,10,,unknown,0,0,0,0,0,0,1,The user employs its psychic power to switch changes to its Defense and Sp. Def stats with the target.,,The user employs its psychic power to switch changes to its Defense and Sp. Def stats with the target.,,championslab
guillotine,Guillotine,Guillotine,normal,physical,,30,5,,unknown,0,0,0,0,0,0,0,A vicious tearing attack with big pincers. The target faints instantly if this attack hits.,,A vicious tearing attack with big pincers. The target faints instantly if this attack hits.,,championslab
gunk_shot,Gunk Shot,Gunk Shot,poison,physical,120,80,5,,unknown,0,0,0,0,0,0,0,The user shoots filthy garbage at the target to attack. This may also poison the target.,,The user shoots filthy garbage at the target to attack. This may also poison the target.,,championslab
gyro_ball,Gyro Ball,Gyro Ball,steel,physical,,100,5,,unknown,0,0,0,0,0,0,0,"The user tackles the target with a high-speed spin. The slower the user is than the target, the greater the move's power.",,"The user tackles the target with a high-speed spin. The slower the user is than the target, the greater the move's power.",,championslab
hammer_arm,Hammer Arm,Hammer Arm,fighting,physical,100,90,10,,unknown,0,0,0,0,0,0,0,"The user swings its strong, heavy fist at the target to inflict damage. This also lowers the user's Speed stat.",,"The user swings its strong, heavy fist at the target to inflict damage. This also lowers the user's Speed stat.",,championslab
hard_press,Hard Press,Hard Press,steel,physical,0,100,10,,unknown,0,0,0,0,0,0,0,"The target is crushed with an arm, a claw, or the like to inflict damage. The more HP the target has left, the greater the move's power.",,"The target is crushed with an arm, a claw, or the like to inflict damage. The more HP the target has left, the greater the move's power.",,championslab
haze,Haze,Haze,ice,status,,,30,,unknown,0,0,0,0,0,0,1,The user creates a haze that eliminates every stat change among all the Pokémon engaged in battle.,,The user creates a haze that eliminates every stat change among all the Pokémon engaged in battle.,,championslab
head_smash,Head Smash,Head Smash,rock,physical,150,80,5,,unknown,0,0,0,0,0,0,0,The user attacks the target with a hazardous full-power headbutt. This also damages the user terribly.,,The user attacks the target with a hazardous full-power headbutt. This also damages the user terribly.,,championslab
headbutt,Headbutt,Headbutt,normal,physical,70,100,15,,unknown,0,0,0,0,0,0,0,The user sticks out its head and attacks by charging straight into the target. This may also make the target flinch.,,The user sticks out its head and attacks by charging straight into the target. This may also make the target flinch.,,championslab
headlong_rush,Headlong Rush,Headlong Rush,ground,physical,120,100,5,,unknown,0,0,0,0,0,0,0,Lowers the user's Defense and Sp. Def stats by 1 stage.,,Lowers the user's Defense and Sp. Def stats by 1 stage.,,championslab
heal_bell,Heal Bell,Heal Bell,normal,status,,,5,,unknown,0,0,0,0,0,0,1,The user makes a soothing bell chime to cure the status conditions of all its fellow party Pokémon and allies.,,The user makes a soothing bell chime to cure the status conditions of all its fellow party Pokémon and allies.,,championslab
heal_pulse,Heal Pulse,Heal Pulse,psychic,status,,,10,,unknown,0,0,0,0,0,0,1,The user emits a healing pulse that restores the target's HP by up to half its max HP.,,The user emits a healing pulse that restores the target's HP by up to half its max HP.,,championslab
healing_wish,Healing Wish,Healing Wish,psychic,status,,,10,,unknown,0,0,0,0,0,0,1,"The user faints. In return, the Pokémon taking its place will have its HP restored and status conditions cured.",,"The user faints. In return, the Pokémon taking its place will have its HP restored and status conditions cured.",,championslab
heat_crash,Heat Crash,Heat Crash,fire,physical,,100,20,,unknown,0,0,0,0,0,0,0,The more the user outweighs the target the greater this move's power (ranging between 40 and 120). If the target has the Minimized status this move's power is doubled and it will be sure to hit.,,The more the user outweighs the target the greater this move's power (ranging between 40 and 120). If the target has the Minimized status this move's power is doubled and it will be sure to hit.,,championslab
heat_wave,Heat Wave,Heat Wave,fire,special,95,90,10,,unknown,0,0,0,0,0,0,0,Exhales a hot breath on the foe. May inflict a burn.,,Exhales a hot breath on the foe. May inflict a burn.,,championslab
heavy_slam,Heavy Slam,Heavy Slam,steel,physical,,100,10,,unknown,0,0,0,0,0,0,0,"The user slams into the target with its heavy body. The more the user outweighs the target, the greater the move's power.",,"The user slams into the target with its heavy body. The more the user outweighs the target, the greater the move's power.",,championslab
helping_hand,Helping Hand,Helping Hand,normal,status,,,20,,unknown,0,0,0,0,0,0,1,The user assists an ally by boosting the power of that ally's attack.,,The user assists an ally by boosting the power of that ally's attack.,,championslab
hex,Hex,Hex,ghost,special,65,100,10,,unknown,0,0,0,0,0,0,0,This relentless attack does massive damage to a target affected by status conditions.,,This relentless attack does massive damage to a target affected by status conditions.,,championslab
hidden_power,Hidden Power,Hidden Power,normal,special,60,100,15,,unknown,0,0,0,0,0,0,0,The power varies with the POKéMON.,,The power varies with the POKéMON.,,championslab
high_horsepower,High Horsepower,High Horsepower,ground,physical,95,95,10,,unknown,0,0,0,0,0,0,0,The user fiercely attacks the target using its entire body.,,The user fiercely attacks the target using its entire body.,,championslab
high_jump_kick,High Jump Kick,High Jump Kick,fighting,physical,130,90,10,,unknown,0,0,0,0,0,0,0,"The target is attacked with a knee kick from a jump. If this move misses, the user takes damage instead.",,"The target is attacked with a knee kick from a jump. If this move misses, the user takes damage instead.",,championslab
horn_drill,Horn Drill,Horn Drill,normal,physical,,30,20,,unknown,0,0,0,0,0,0,0,Knocks out the target. The accuracy of this move is fixed at 30%.,,Knocks out the target. The accuracy of this move is fixed at 30%.,,championslab
horn_leech,Horn Leech,Horn Leech,grass,physical,75,100,10,,unknown,0,0,0,0,0,0,0,The user drains the target's energy with its horns. The user's HP is restored by up to half the damage taken by the target.,,The user drains the target's energy with its horns. The user's HP is restored by up to half the damage taken by the target.,,championslab
howl,Howl,Howl,normal,status,,,40,,unknown,0,0,0,0,0,0,1,The user howls loudly to rouse itself and its allies. This boosts their Attack stats.,,The user howls loudly to rouse itself and its allies. This boosts their Attack stats.,,championslab
hurricane,Hurricane,Hurricane,flying,special,110,70,10,,unknown,0,0,0,0,0,0,0,The user attacks by wrapping its opponent in a fierce wind that flies up into the sky. It may also confuse the target.,,The user attacks by wrapping its opponent in a fierce wind that flies up into the sky. It may also confuse the target.,,championslab
hydro_cannon,Hydro Cannon,Hydro Cannon,water,special,150,90,5,,unknown,0,0,0,0,0,0,0,"Powerful, but leaves the user immobile the next turn.",,"Powerful, but leaves the user immobile the next turn.",,championslab
hydro_pump,Hydro Pump,Hydro Pump,water,special,110,80,5,,unknown,0,0,0,0,0,0,0,The target is blasted by a huge volume of water launched under great pressure.,,The target is blasted by a huge volume of water launched under great pressure.,,championslab
hyper_beam,Hyper Beam,Hyper Beam,normal,special,150,90,5,,unknown,0,0,0,0,0,0,0,The target is attacked with a powerful beam. The user can't move on the next turn.,,The target is attacked with a powerful beam. The user can't move on the next turn.,,championslab
hyper_voice,Hyper Voice,Hyper Voice,normal,special,90,100,10,,unknown,0,1,0,0,0,0,0,"The user attacks by letting loose a horribly loud, resounding cry.",,"The user attacks by letting loose a horribly loud, resounding cry.",,championslab
hypnosis,Hypnosis,Hypnosis,psychic,status,,60,20,,unknown,0,0,0,0,0,0,1,Puts the target to sleep.,,Puts the target to sleep.,,championslab
ice_beam,Ice Beam,Ice Beam,ice,special,90,100,10,,unknown,0,0,0,0,0,0,0,The target is struck with an icy-cold beam of energy. This may also leave the target frozen.,,The target is struck with an icy-cold beam of energy. This may also leave the target frozen.,,championslab
ice_fang,Ice Fang,Ice Fang,ice,physical,65,95,15,,unknown,0,0,0,0,1,0,0,The user bites with cold-infused fangs. This may also make the target flinch or leave it frozen.,,The user bites with cold-infused fangs. This may also make the target flinch or leave it frozen.,,championslab
ice_hammer,Ice Hammer,Ice Hammer,ice,physical,100,90,10,,unknown,0,0,0,0,0,0,0,Lowers the user's Speed stat by 1 stage.,,Lowers the user's Speed stat by 1 stage.,,championslab
ice_punch,Ice Punch,Ice Punch,ice,physical,75,100,15,,unknown,0,0,0,1,0,0,0,The target is attacked with an icy punch. This may also leave the target frozen.,,The target is attacked with an icy punch. This may also leave the target frozen.,,championslab
ice_shard,Ice Shard,Ice Shard,ice,physical,40,100,30,,unknown,0,0,0,0,0,0,0,The user flash freezes chunks of ice and hurls them. This move always goes first.,,The user flash freezes chunks of ice and hurls them. This move always goes first.,,championslab
ice_spinner,Ice Spinner,Ice Spinner,ice,physical,80,100,15,,unknown,0,0,0,0,0,0,0,"The user covers its feet in thin ice and twirls around, slamming into the target. This move's spinning motion also destroys the terrain.",,"The user covers its feet in thin ice and twirls around, slamming into the target. This move's spinning motion also destroys the terrain.",,championslab
icicle_crash,Icicle Crash,Icicle Crash,ice,physical,85,90,10,,unknown,0,0,0,0,0,0,0,The user attacks by crashing large icicles onto the target. This may also make the target flinch.,,The user attacks by crashing large icicles onto the target. This may also make the target flinch.,,championslab
icicle_spear,Icicle Spear,Icicle Spear,ice,physical,25,100,30,,unknown,0,0,0,0,0,0,0,Attacks the foe by firing 2 to 5 icicles in a row.,,Attacks the foe by firing 2 to 5 icicles in a row.,,championslab
icy_wind,Icy Wind,Icy Wind,ice,special,55,95,15,,unknown,0,0,0,0,0,0,0,The user attacks with a gust of chilled air. This also lowers opposing Pokémon's Speed stats.,,The user attacks with a gust of chilled air. This also lowers opposing Pokémon's Speed stats.,,championslab
imprison,Imprison,Imprison,psychic,status,,,10,,unknown,0,0,0,0,0,0,1,"If opposing Pokémon know any move also known by the user, they are prevented from using it.",,"If opposing Pokémon know any move also known by the user, they are prevented from using it.",,championslab
infernal_parade,Infernal Parade,Infernal Parade,ghost,special,65,100,15,,unknown,0,0,0,0,0,0,0,The user attacks with myriad fireballs. This may also leave the target with a burn. This move's power is doubled if the target has a status condition.,,The user attacks with myriad fireballs. This may also leave the target with a burn. This move's power is doubled if the target has a status condition.,,championslab
inferno,Inferno,Inferno,fire,special,100,50,10,,unknown,0,0,0,0,0,0,0,Burns the target.,,Burns the target.,,championslab
infestation,Infestation,Infestation,bug,special,20,100,20,,unknown,0,0,0,0,0,0,0,The target is infested and attacked for four to five turns. The target can't flee during this time.,,The target is infested and attacked for four to five turns. The target can't flee during this time.,,championslab
ingrain,Ingrain,Ingrain,grass,status,,,20,,unknown,0,0,0,0,0,0,1,The user gains the Ingrained status.,,The user gains the Ingrained status.,,championslab
instruct,Instruct,Instruct,psychic,status,,,15,,unknown,0,0,0,0,0,0,1,The user instructs the target to reuse the move last used by the target.,,The user instructs the target to reuse the move last used by the target.,,championslab
iron_defense,Iron Defense,Iron Defense,steel,status,,,15,,unknown,0,0,0,0,0,0,1,"The user hardens its body's surface like iron, sharply boosting its Defense stat.",,"The user hardens its body's surface like iron, sharply boosting its Defense stat.",,championslab
iron_head,Iron Head,Iron Head,steel,physical,80,100,16,,unknown,0,0,0,0,0,0,0,The user slams the target with its steel-hard head. This may also make the target flinch.,,The user slams the target with its steel-hard head. This may also make the target flinch.,,championslab
iron_tail,Iron Tail,Iron Tail,steel,physical,100,75,15,,unknown,0,0,0,0,0,0,0,An attack that may reduce DEFENSE.,,An attack that may reduce DEFENSE.,,championslab
jet_punch,Jet Punch,Jet Punch,water,physical,60,100,15,,unknown,0,0,0,0,0,0,0,The user summons a torrent around its fist and punches at blinding speed. This move always goes first.,,The user summons a torrent around its fist and punches at blinding speed. This move always goes first.,,championslab
kings_shield,King's Shield,King's Shield,steel,status,0,0,10,,unknown,0,0,0,0,0,0,1,Protects the user from attacks. Lowers Attack of any attacker that makes contact.,,Protects the user from attacks. Lowers Attack of any attacker that makes contact.,,championslab
knock_off,Knock Off,Knock Off,dark,physical,65,100,20,,unknown,1,0,0,0,0,0,0,"The user slaps down the target's held item, making it unusable for that battle. This move does more damage if the target has a held item.",,"The user slaps down the target's held item, making it unusable for that battle. This move does more damage if the target has a held item.",,championslab
kowtow_cleave,Kowtow Cleave,Kowtow Cleave,dark,physical,85,,10,,unknown,0,0,0,0,0,0,0,The user slashes at the target after kowtowing to make the target let down its guard. This attack never misses.,,The user slashes at the target after kowtowing to make the target let down its guard. This attack never misses.,,championslab
laser_focus,Laser Focus,Laser Focus,normal,status,,,30,,unknown,0,0,0,0,0,0,1,The user concentrates intensely. The attack on the next turn always results in a critical hit.,,The user concentrates intensely. The attack on the next turn always results in a critical hit.,,championslab
lash_out,Lash Out,Lash Out,dark,physical,75,100,5,,unknown,0,0,0,0,0,0,0,The user lashes out to vent its frustration toward the target. This move's power is doubled if the user's stats were lowered during this turn.,,The user lashes out to vent its frustration toward the target. This move's power is doubled if the user's stats were lowered during this turn.,,championslab
last_resort,Last Resort,Last Resort,normal,physical,140,100,5,,unknown,0,0,0,0,0,0,0,This move can be used only after the user has used all the other moves it knows in the battle.,,This move can be used only after the user has used all the other moves it knows in the battle.,,championslab
last_respects,Last Respects,Last Respects,ghost,physical,50,100,10,,unknown,0,0,0,0,0,0,0,"The user attacks to avenge its allies. The more defeated allies there are in the user's party, the greater the move's power.",,"The user attacks to avenge its allies. The more defeated allies there are in the user's party, the greater the move's power.",,championslab
lava_plume,Lava Plume,Lava Plume,fire,special,80,100,15,,unknown,0,0,0,0,0,0,0,An inferno of scarlet flames washes over all Pokémon in battle. It may also inflict burns.,,An inferno of scarlet flames washes over all Pokémon in battle. It may also inflict burns.,,championslab
leaf_blade,Leaf Blade,Leaf Blade,grass,physical,90,100,15,,unknown,1,0,0,0,0,1,0,The user handles a sharp leaf like a sword and cuts the target to inflict damage. This move has a heightened chance of landing a critical hit.,,The user handles a sharp leaf like a sword and cuts the target to inflict damage. This move has a heightened chance of landing a critical hit.,,championslab
leaf_storm,Leaf Storm,Leaf Storm,grass,special,130,90,5,,unknown,0,0,0,0,0,0,0,The user whips up a storm of leaves around the target. The recoil from this move harshly lowers the user's Sp. Atk stat.,,The user whips up a storm of leaves around the target. The recoil from this move harshly lowers the user's Sp. Atk stat.,,championslab
leech_life,Leech Life,Leech Life,bug,physical,80,100,10,,unknown,0,0,0,0,0,0,0,The user drains the target's blood. The user's HP is restored by up to half the damage taken by the target.,,The user drains the target's blood. The user's HP is restored by up to half the damage taken by the target.,,championslab
leech_seed,Leech Seed,Leech Seed,grass,status,,90,20,,unknown,0,0,0,0,0,0,1,Gives the target the Leech Seeded status.,,Gives the target the Leech Seeded status.,,championslab
leer,Leer,Leer,normal,status,,100,30,,unknown,0,0,0,0,0,0,1,"The user gives the target an intimidating leer, which lowers the target's Defense stat.",,"The user gives the target an intimidating leer, which lowers the target's Defense stat.",,championslab
life_dew,Life Dew,Life Dew,water,status,,,10,,unknown,0,0,0,0,0,0,1,The user scatters mysterious water around and restores the HP of itself and its ally Pokémon currently in the battle.,,The user scatters mysterious water around and restores the HP of itself and its ally Pokémon currently in the battle.,,championslab
light_of_ruin,Light of Ruin,Light of Ruin,fairy,special,140,90,5,,unknown,0,0,0,0,0,0,0,The user attacks by drawing power from the Eternal Flower to fire off a powerful beam of light. The user also takes some recoil damage.,,The user attacks by drawing power from the Eternal Flower to fire off a powerful beam of light. The user also takes some recoil damage.,,championslab
light_screen,Light Screen,Light Screen,psychic,status,,,30,,unknown,0,0,0,0,0,0,1,A wondrous wall of light is put up to reduce damage from special moves for five turns.,,A wondrous wall of light is put up to reduce damage from special moves for five turns.,,championslab
liquidation,Liquidation,Liquidation,water,physical,85,100,10,,unknown,0,0,0,0,0,0,0,The user slams into the target using a full-force blast of water. This may also lower the target's Defense stat.,,The user slams into the target using a full-force blast of water. This may also lower the target's Defense stat.,,championslab
lock_on,Lock-On,Lock-On,normal,status,,,5,,unknown,0,0,0,0,0,0,1,The user takes sure aim at the target. This ensures the user's next move does not miss that target.,,The user takes sure aim at the target. This ensures the user's next move does not miss that target.,,championslab
low_kick,Low Kick,Low Kick,fighting,physical,,100,20,,unknown,0,0,0,0,0,0,0,"A powerful low kick that makes the target fall over. The heavier the target, the greater the move's power.",,"A powerful low kick that makes the target fall over. The heavier the target, the greater the move's power.",,championslab
