move_key,name_en,name_es,type_key,category_key,power,accuracy,pp,priority,targeting_key,makes_contact,is_sound,is_pulse,is_punch,is_bite,is_slashing,is_status,effect_short_en,effect_short_es,effect_long_en,effect_long_es,source_key
cotton_guard,Cotton Guard,Cotton Guard,grass,status,,,10,,unknown,0,0,0,0,0,0,1,"The user protects itself by wrapping its body in soft cotton, drastically boosting its Defense stat.",,"The user protects itself by wrapping its body in soft cotton, drastically boosting its Defense stat.",,championslab
cotton_spore,Cotton Spore,Cotton Spore,grass,status,,100,40,,unknown,0,0,0,0,0,0,1,The user releases cotton-like spores that cling to opposing Pokémon. This harshly lowers their Speed stats.,,The user releases cotton-like spores that cling to opposing Pokémon. This harshly lowers their Speed stats.,,championslab
counter,Counter,Counter,fighting,physical,,100,20,,unknown,0,0,0,0,0,0,0,The user retaliates to deal double the damage it took from an opponent's physical move during the turn this move is used.,,The user retaliates to deal double the damage it took from an opponent's physical move during the turn this move is used.,,championslab
covet,Covet,Covet,normal,physical,60,100,25,,unknown,0,0,0,0,0,0,0,"The user endearingly approaches the target, then steals the target's held item.",,"The user endearingly approaches the target, then steals the target's held item.",,championslab
crabhammer,Crabhammer,Crabhammer,water,physical,95,,10,,unknown,0,0,0,0,0,0,0,This move has a 1-stage Critical-Hit Ratio Boost.,,This move has a 1-stage Critical-Hit Ratio Boost.,,championslab
cross_chop,Cross Chop,Cross Chop,fighting,physical,100,80,5,,unknown,0,0,0,0,0,0,0,The user delivers a double chop with its forearms crossed. This move has a heightened chance of landing a critical hit.,,The user delivers a double chop with its forearms crossed. This move has a heightened chance of landing a critical hit.,,championslab
cross_poison,Cross Poison,Cross Poison,poison,physical,70,100,20,,unknown,0,0,0,0,0,0,0,A slashing attack with a poisonous blade that may also poison the target. This move has a heightened chance of landing a critical hit.,,A slashing attack with a poisonous blade that may also poison the target. This move has a heightened chance of landing a critical hit.,,championslab
crunch,Crunch,Crunch,dark,physical,80,100,15,,unknown,0,0,0,0,1,0,0,The user crunches up the target with sharp fangs. This may also lower the target's Defense stat.,,The user crunches up the target with sharp fangs. This may also lower the target's Defense stat.,,championslab
crush_claw,Crush Claw,Crush Claw,normal,physical,75,95,10,,unknown,0,0,0,0,0,0,0,The user slashes the target with hard and sharp claws. This may also lower the target's Defense stat.,,The user slashes the target with hard and sharp claws. This may also lower the target's Defense stat.,,championslab
curse,Curse,Curse,ghost,status,,,10,,unknown,0,0,0,0,0,0,1,A move that has different effects depending on whether the user is a Ghost type or not.,,A move that has different effects depending on whether the user is a Ghost type or not.,,championslab
dark_pulse,Dark Pulse,Dark Pulse,dark,special,80,100,15,,unknown,0,0,1,0,0,0,0,The user releases a horrible aura imbued with ill intent. This may also make the target flinch.,,The user releases a horrible aura imbued with ill intent. This may also make the target flinch.,,championslab
darkest_lariat,Darkest Lariat,Darkest Lariat,dark,physical,85,100,10,,unknown,0,0,0,0,0,0,0,The user swings both arms and hits the target. The target's stat changes don't affect the damage inflicted by this move.,,The user swings both arms and hits the target. The target's stat changes don't affect the damage inflicted by this move.,,championslab
dazzling_gleam,Dazzling Gleam,Dazzling Gleam,fairy,special,80,100,10,,unknown,0,0,0,0,0,0,0,The user damages opposing Pokémon by emitting a powerful flash.,,The user damages opposing Pokémon by emitting a powerful flash.,,championslab
decorate,Decorate,Decorate,fairy,status,0,,15,,unknown,0,0,0,0,0,0,1,The user sharply raises the target’s Attack and Sp. Atk stats by decorating the target.,,The user sharply raises the target’s Attack and Sp. Atk stats by decorating the target.,,championslab
defog,Defog,Defog,flying,status,,,20,,unknown,0,0,0,0,0,0,1,Lowers the target's evasiveness by 1 stage. Removes statuses such as Reflect Spikes and Safeguard as well as any terrain.,,Lowers the target's evasiveness by 1 stage. Removes statuses such as Reflect Spikes and Safeguard as well as any terrain.,,championslab
destiny_bond,Destiny Bond,Destiny Bond,ghost,status,,,20,,unknown,0,0,0,0,0,0,1,The user gains the Destiny Bound status. This move fails if used in succession.,,The user gains the Destiny Bound status. This move fails if used in succession.,,championslab
detect,Detect,Detect,fighting,status,,,20,,unknown,0,0,0,0,0,0,1,The user protects itself from incoming moves for the turn. With each consecutive use this move's chance of success becomes 1/3 of what it was before.,,The user protects itself from incoming moves for the turn. With each consecutive use this move's chance of success becomes 1/3 of what it was before.,,championslab
dig,Dig,Dig,ground,physical,80,100,10,,unknown,0,0,0,0,0,0,0,"The user burrows into the ground on the first turn, then attacks on the next turn.",,"The user burrows into the ground on the first turn, then attacks on the next turn.",,championslab
dire_claw,Dire Claw,Dire Claw,poison,physical,80,100,16,,unknown,0,0,0,0,0,0,0,"The user lashes out at the target with ruinous claws. This may also leave the target poisoned, paralyzed, or asleep.",,"The user lashes out at the target with ruinous claws. This may also leave the target poisoned, paralyzed, or asleep.",,championslab
disable,Disable,Disable,normal,status,,100,20,,unknown,0,0,0,0,0,0,1,Gives the target the Move Disabled status for 4 turns.,,Gives the target the Move Disabled status for 4 turns.,,championslab
discharge,Discharge,Discharge,electric,special,80,100,15,,unknown,0,0,0,0,0,0,0,The user strikes everything around it by letting loose a flare of electricity. This may also leave those hit by the attack with paralysis.,,The user strikes everything around it by letting loose a flare of electricity. This may also leave those hit by the attack with paralysis.,,championslab
dive,Dive,Dive,water,physical,80,100,10,,unknown,0,0,0,0,0,0,0,"The user dives on the first turn, then floats up and attacks on the next turn.",,"The user dives on the first turn, then floats up and attacks on the next turn.",,championslab
double_edge,Double-Edge,Double-Edge,normal,physical,120,100,15,,unknown,0,0,0,0,0,0,0,A reckless life-risking tackle in which the user rushes the target. This also damages the user quite a lot.,,A reckless life-risking tackle in which the user rushes the target. This also damages the user quite a lot.,,championslab
double_hit,Double Hit,Double Hit,normal,physical,35,90,10,,unknown,0,0,0,0,0,0,0,The user slams the target with a tail or the like. The target is hit twice in a row.,,The user slams the target with a tail or the like. The target is hit twice in a row.,,championslab
double_kick,Double Kick,Double Kick,fighting,physical,30,100,30,,unknown,0,0,0,0,0,0,0,The user attacks by kicking the target twice in a row using two feet.,,The user attacks by kicking the target twice in a row using two feet.,,championslab
double_slap,Double Slap,Double Slap,normal,physical,15,85,10,,unknown,0,0,0,0,0,0,0,Repeatedly slaps 2-5 times.,,Repeatedly slaps 2-5 times.,,championslab
double_team,Double Team,Double Team,normal,status,,,15,,unknown,0,0,0,0,0,0,1,"By moving rapidly, the user makes illusory copies of itself to boost its evasiveness.",,"By moving rapidly, the user makes illusory copies of itself to boost its evasiveness.",,championslab
draco_meteor,Draco Meteor,Draco Meteor,dragon,special,130,90,5,,unknown,0,0,0,0,0,0,0,Comets are summoned down from the sky onto the target. The recoil from this move harshly lowers the user’s Sp. Atk stat.,,Comets are summoned down from the sky onto the target. The recoil from this move harshly lowers the user’s Sp. Atk stat.,,championslab
dragon_breath,Dragon Breath,Dragon Breath,dragon,special,60,100,20,,unknown,0,0,0,0,0,0,0,The user exhales a mighty gust at the target. This may also leave the target with paralysis.,,The user exhales a mighty gust at the target. This may also leave the target with paralysis.,,championslab
dragon_cheer,Dragon Cheer,Dragon Cheer,dragon,status,0,0,15,,unknown,0,0,0,0,0,0,1,The user raises its allies’ morale with a draconic cry so that their future attacks have a heightened chance of landing critical hits. This rouses Dragon types more.,,The user raises its allies’ morale with a draconic cry so that their future attacks have a heightened chance of landing critical hits. This rouses Dragon types more.,,championslab
dragon_claw,Dragon Claw,Dragon Claw,dragon,physical,80,100,15,,unknown,0,0,0,0,0,0,0,Slashes the foe with sharp claws.,,Slashes the foe with sharp claws.,,championslab
dragon_dance,Dragon Dance,Dragon Dance,dragon,status,,,20,,unknown,0,0,0,0,0,0,1,"The user vigorously performs a mystic, powerful dance that boosts its Attack and Speed stats.",,"The user vigorously performs a mystic, powerful dance that boosts its Attack and Speed stats.",,championslab
dragon_darts,Dragon Darts,Dragon Darts,dragon,physical,50,100,10,,unknown,0,0,0,0,0,0,0,"The user attacks twice using Dreepy. If there are two opposing Pokémon, this move hits each of them once.",,"The user attacks twice using Dreepy. If there are two opposing Pokémon, this move hits each of them once.",,championslab
dragon_pulse,Dragon Pulse,Dragon Pulse,dragon,special,85,100,10,,unknown,0,0,1,0,0,0,0,The target is attacked with a shock wave generated by the user's gaping mouth.,,The target is attacked with a shock wave generated by the user's gaping mouth.,,championslab
dragon_rush,Dragon Rush,Dragon Rush,dragon,physical,100,75,10,,unknown,0,0,0,0,0,0,0,The user tackles the target while exhibiting overwhelming menace. This may also make the target flinch.,,The user tackles the target while exhibiting overwhelming menace. This may also make the target flinch.,,championslab
dragon_tail,Dragon Tail,Dragon Tail,dragon,physical,60,90,10,,unknown,0,0,0,0,0,0,0,"The target is knocked away, and a different Pokémon is dragged out. In the wild, this ends a battle against a single Pokémon.",,"The target is knocked away, and a different Pokémon is dragged out. In the wild, this ends a battle against a single Pokémon.",,championslab
drain_punch,Drain Punch,Drain Punch,fighting,physical,75,100,10,,unknown,1,0,0,1,0,0,0,The user attacks with an energy-draining punch. The user's HP is restored by up to half the damage taken by the target.,,The user attacks with an energy-draining punch. The user's HP is restored by up to half the damage taken by the target.,,championslab
draining_kiss,Draining Kiss,Draining Kiss,fairy,special,50,100,10,,unknown,0,0,0,0,0,0,0,The user steals the target's HP with a kiss. The user's HP is restored by over half the damage taken by the target.,,The user steals the target's HP with a kiss. The user's HP is restored by over half the damage taken by the target.,,championslab
drill_peck,Drill Peck,Drill Peck,flying,physical,80,100,20,,unknown,0,0,0,0,0,0,0,A corkscrewing attack that strikes the target with a sharp beak acting as a drill.,,A corkscrewing attack that strikes the target with a sharp beak acting as a drill.,,championslab
drill_run,Drill Run,Drill Run,ground,physical,80,95,10,,unknown,0,0,0,0,0,0,0,The user crashes into its target while rotating its body like a drill. Critical hits land more easily.,,The user crashes into its target while rotating its body like a drill. Critical hits land more easily.,,championslab
dual_wingbeat,Dual Wingbeat,Dual Wingbeat,flying,physical,40,90,10,,unknown,0,0,0,0,0,0,0,The user slams the target with its wings to inflict damage. The target is hit twice in a row.,,The user slams the target with its wings to inflict damage. The target is hit twice in a row.,,championslab
dynamic_punch,Dynamic Punch,Dynamic Punch,fighting,physical,100,50,10,,unknown,0,0,0,0,0,0,0,Confuses the target.,,Confuses the target.,,championslab
earth_power,Earth Power,Earth Power,ground,special,90,100,10,,unknown,0,0,0,0,0,0,0,The user makes the ground under the target erupt with power. This may also lower the target's Sp. Def stat.,,The user makes the ground under the target erupt with power. This may also lower the target's Sp. Def stat.,,championslab
earthquake,Earthquake,Earthquake,ground,physical,100,100,10,,unknown,0,0,0,0,0,0,0,The user sets off an earthquake that strikes every Pokémon around it.,,The user sets off an earthquake that strikes every Pokémon around it.,,championslab
eerie_impulse,Eerie Impulse,Eerie Impulse,electric,status,,100,15,,unknown,0,0,0,0,0,0,1,The user's body generates an eerie impulse. Exposing the target to it harshly lowers the target's Sp. Atk stat.,,The user's body generates an eerie impulse. Exposing the target to it harshly lowers the target's Sp. Atk stat.,,championslab
eerie_spell,Eerie Spell,Eerie Spell,psychic,special,80,100,5,,unknown,0,0,0,0,0,0,0,The user attacks with its tremendous psychic power. This also removes 3 PP from the target’s last move.,,The user attacks with its tremendous psychic power. This also removes 3 PP from the target’s last move.,,championslab
electric_terrain,Electric Terrain,Electric Terrain,electric,status,,,10,,unknown,0,0,0,0,0,0,1,"The user turns the ground into Electric Terrain for five turns, powering up Electric-type moves. Pokémon on the ground can no longer fall asleep.",,"The user turns the ground into Electric Terrain for five turns, powering up Electric-type moves. Pokémon on the ground can no longer fall asleep.",,championslab
electrify,Electrify,Electrify,electric,status,,,20,,unknown,0,0,0,0,0,0,1,"If the target is electrified before it uses a move during that turn, the target’s move becomes Electric type.",,"If the target is electrified before it uses a move during that turn, the target’s move becomes Electric type.",,championslab
electro_ball,Electro Ball,Electro Ball,electric,special,,100,10,,unknown,0,0,0,0,0,0,0,"The user hurls an electric orb at the target. The faster the user is than the target, the greater the move's power.",,"The user hurls an electric orb at the target. The faster the user is than the target, the greater the move's power.",,championslab
electro_shot,Electro Shot,Electro Shot,electric,special,130,100,10,,unknown,0,0,0,0,0,0,0,"The user gathers electricity on the first turn, boosting its Sp. Atk stat, then fires a high-voltage shot on the next turn. The shot will be fired immediately in rain.",,"The user gathers electricity on the first turn, boosting its Sp. Atk stat, then fires a high-voltage shot on the next turn. The shot will be fired immediately in rain.",,championslab
electroweb,Electroweb,Electroweb,electric,special,55,95,15,,unknown,0,0,0,0,0,0,0,The user captures opposing Pokémon in an electric net to inflict damage. This also lowers their Speed stats.,,The user captures opposing Pokémon in an electric net to inflict damage. This also lowers their Speed stats.,,championslab
encore,Encore,Encore,normal,status,,100,5,,unknown,0,0,0,0,0,0,1,The user compels the target to keep using the move it encored for three turns.,,The user compels the target to keep using the move it encored for three turns.,,championslab
endeavor,Endeavor,Endeavor,normal,physical,,100,5,,unknown,0,0,0,0,0,0,0,The user inflicts damage by cutting down the target's HP to roughly equal the user's HP.,,The user inflicts damage by cutting down the target's HP to roughly equal the user's HP.,,championslab
endure,Endure,Endure,normal,status,,,10,,unknown,0,0,0,0,0,0,1,The user endures any attack with at least 1 HP. This move's chance of failing rises if used in succession.,,The user endures any attack with at least 1 HP. This move's chance of failing rises if used in succession.,,championslab
energy_ball,Energy Ball,Energy Ball,grass,special,90,100,10,,unknown,0,0,0,0,0,0,0,The user draws power from nature and fires it at the target. This may also lower the target's Sp. Def stat.,,The user draws power from nature and fires it at the target. This may also lower the target's Sp. Def stat.,,championslab
entrainment,Entrainment,Entrainment,normal,status,,100,20,,unknown,0,0,0,0,0,0,1,Changes the target's Ability to be the same as the user's.,,Changes the target's Ability to be the same as the user's.,,championslab
eruption,Eruption,Eruption,fire,special,150,100,5,,unknown,0,0,0,0,0,0,0,"The user attacks opposing Pokémon with explosive fury. The lower the user's HP, the lower the move's power.",,"The user attacks opposing Pokémon with explosive fury. The lower the user's HP, the lower the move's power.",,championslab
expanding_force,Expanding Force,Expanding Force,psychic,special,80,100,10,,unknown,0,0,0,0,0,0,0,"The user attacks the target with its psychic power. When the ground is Psychic Terrain, this move's power is boosted and it damages all opposing Pokémon.",,"The user attacks the target with its psychic power. When the ground is Psychic Terrain, this move's power is boosted and it damages all opposing Pokémon.",,championslab
explosion,Explosion,Explosion,normal,physical,250,100,5,,unknown,0,0,0,0,0,0,0,The user faints upon using this move.,,The user faints upon using this move.,,championslab
extrasensory,Extrasensory,Extrasensory,psychic,special,80,100,20,,unknown,0,0,0,0,0,0,0,"The user attacks with an odd, unseeable power. This may also make the target flinch.",,"The user attacks with an odd, unseeable power. This may also make the target flinch.",,championslab
extreme_speed,Extreme Speed,Extreme Speed,normal,physical,80,100,5,,unknown,0,0,0,0,0,0,0,The user charges the target at blinding speed. This move always goes first.,,The user charges the target at blinding speed. This move always goes first.,,championslab
facade,Facade,Facade,normal,physical,70,100,20,,unknown,0,0,0,0,0,0,0,"This move's power is doubled if the user is poisoned, burned, or paralyzed.",,"This move's power is doubled if the user is poisoned, burned, or paralyzed.",,championslab
fairy_lock,Fairy Lock,Fairy Lock,fairy,status,,,20,,unknown,0,0,0,0,0,0,1,Gives all Pokémon on the field the Fairy Locked status.,,Gives all Pokémon on the field the Fairy Locked status.,,championslab
fake_out,Fake Out,Fake Out,normal,physical,40,100,10,,unknown,1,0,0,0,0,0,0,This attack hits first and makes the target flinch. It works only on the first turn each time the user enters battle.,,This attack hits first and makes the target flinch. It works only on the first turn each time the user enters battle.,,championslab
fake_tears,Fake Tears,Fake Tears,dark,status,,100,20,,unknown,0,0,0,0,0,0,1,The user feigns crying to fluster the target. This harshly lowers the target's Sp. Def stat.,,The user feigns crying to fluster the target. This harshly lowers the target's Sp. Def stat.,,championslab
feather_dance,Feather Dance,Feather Dance,flying,status,,100,15,,unknown,0,0,0,0,0,0,1,The user covers the target's body with a mass of down that harshly lowers its Attack stat.,,The user covers the target's body with a mass of down that harshly lowers its Attack stat.,,championslab
feint,Feint,Feint,normal,physical,30,100,20,,unknown,0,0,0,0,0,0,0,This move can hit a target using a move such as Protect or Detect and removes the effects of those moves.,,This move can hit a target using a move such as Protect or Detect and removes the effects of those moves.,,championslab
fell_stinger,Fell Stinger,Fell Stinger,bug,physical,50,100,25,,unknown,0,0,0,0,0,0,0,"When the user knocks out a target with this move, the user's Attack stat is boosted drastically.",,"When the user knocks out a target with this move, the user's Attack stat is boosted drastically.",,championslab
fickle_beam,Fickle Beam,Fickle Beam,dragon,special,80,100,5,,unknown,0,0,0,0,0,0,0,"The user shoots a beam of light to inflict damage. Sometimes all the user's heads shoot beams in unison, doubling the move's power.",,"The user shoots a beam of light to inflict damage. Sometimes all the user's heads shoot beams in unison, doubling the move's power.",,championslab
fiery_dance,Fiery Dance,Fiery Dance,fire,special,80,100,10,,unknown,0,0,0,0,0,0,0,"Cloaked in flames, the user dances and flaps its wings. It may also raise the user’s Sp. Atk stat.",,"Cloaked in flames, the user dances and flaps its wings. It may also raise the user’s Sp. Atk stat.",,championslab
final_gambit,Final Gambit,Final Gambit,fighting,special,,100,5,,unknown,0,0,0,0,0,0,0,The user risks everything to attack the target. The user faints but inflicts damage equal to its own HP.,,The user risks everything to attack the target. The user faints but inflicts damage equal to its own HP.,,championslab
fire_blast,Fire Blast,Fire Blast,fire,special,110,85,5,,unknown,0,0,0,0,0,0,0,The target is attacked with an intense blast of all-consuming fire. This may also leave the target with a burn.,,The target is attacked with an intense blast of all-consuming fire. This may also leave the target with a burn.,,championslab
fire_fang,Fire Fang,Fire Fang,fire,physical,65,95,15,,unknown,0,0,0,0,1,0,0,The user bites with flame-cloaked fangs. This may also make the target flinch or leave it with a burn.,,The user bites with flame-cloaked fangs. This may also make the target flinch or leave it with a burn.,,championslab
fire_lash,Fire Lash,Fire Lash,fire,physical,90,100,15,,unknown,0,0,0,0,0,0,0,The user strikes the target with a burning lash. This also lowers the target’s Defense stat.,,The user strikes the target with a burning lash. This also lowers the target’s Defense stat.,,championslab
fire_punch,Fire Punch,Fire Punch,fire,physical,75,100,15,,unknown,0,0,0,0,0,0,0,The target is attacked with a fiery punch. This may also leave the target with a burn.,,The target is attacked with a fiery punch. This may also leave the target with a burn.,,championslab
fire_spin,Fire Spin,Fire Spin,fire,special,35,85,20,,unknown,0,0,0,0,0,0,0,Gives the target the Bound status.,,Gives the target the Bound status.,,championslab
first_impression,First Impression,First Impression,bug,physical,100,100,10,,unknown,0,0,0,0,0,0,0,This move fails unless it is the first move used by the user after it enters a battle.,,This move fails unless it is the first move used by the user after it enters a battle.,,championslab
fissure,Fissure,Fissure,ground,physical,,30,20,,unknown,0,0,0,0,0,0,0,Knocks out the target. The accuracy of this move is fixed at 30%.,,Knocks out the target. The accuracy of this move is fixed at 30%.,,championslab
flail,Flail,Flail,normal,physical,,100,15,,unknown,0,0,0,0,0,0,0,"The user flails about aimlessly to attack. The less HP the user has, the greater the move's power.",,"The user flails about aimlessly to attack. The less HP the user has, the greater the move's power.",,championslab
flame_charge,Flame Charge,Flame Charge,fire,physical,50,100,20,,unknown,0,0,0,0,0,0,0,"The user cloaks itself with flame and attacks. Building up more power, it raises the user’s Speed stat.",,"The user cloaks itself with flame and attacks. Building up more power, it raises the user’s Speed stat.",,championslab
flamethrower,Flamethrower,Flamethrower,fire,special,90,100,15,,unknown,0,0,0,0,0,0,0,The target is scorched with an intense blast of fire. This may also leave the target with a burn.,,The target is scorched with an intense blast of fire. This may also leave the target with a burn.,,championslab
flare_blitz,Flare Blitz,Flare Blitz,fire,physical,120,100,15,,unknown,1,0,0,0,0,0,0,A move called Flare Blitz.,,A move called Flare Blitz.,,championslab
flash_cannon,Flash Cannon,Flash Cannon,steel,special,80,100,10,,unknown,0,0,0,0,0,0,0,The user gathers all its light energy and releases it at once. This may also lower the target's Sp. Def stat.,,The user gathers all its light energy and releases it at once. This may also lower the target's Sp. Def stat.,,championslab
flatter,Flatter,Flatter,dark,status,,100,15,,unknown,0,0,0,0,0,0,1,"Flattery is used to confuse the target. However, this also boosts the target's Sp. Atk stat.",,"Flattery is used to confuse the target. However, this also boosts the target's Sp. Atk stat.",,championslab
fling,Fling,Fling,dark,physical,,100,10,,unknown,0,0,0,0,0,0,0,The user flings its held item at the target to attack. This move's power and effects depend on the item.,,The user flings its held item at the target to attack. This move's power and effects depend on the item.,,championslab
flip_turn,Flip Turn,Flip Turn,water,physical,60,100,20,,unknown,0,0,0,0,0,0,0,"After making its attack, the user rushes back to switch places with a party Pokémon in waiting.",,"After making its attack, the user rushes back to switch places with a party Pokémon in waiting.",,championslab
flower_trick,Flower Trick,Flower Trick,grass,physical,70,,10,,unknown,0,0,0,0,0,0,0,The user throws a rigged bouquet of flowers at the target. This attack never misses and always lands a critical hit.,,The user throws a rigged bouquet of flowers at the target. This attack never misses and always lands a critical hit.,,championslab
fly,Fly,Fly,flying,physical,90,95,15,,unknown,0,0,0,0,0,0,0,"The user flies up into the sky on the first turn, then attacks on the next turn.",,"The user flies up into the sky on the first turn, then attacks on the next turn.",,championslab
flying_press,Flying Press,Flying Press,fighting,physical,100,95,10,,unknown,0,0,0,0,0,0,0,The user dives down onto the target from the sky. This move is Fighting and Flying type simultaneously.,,The user dives down onto the target from the sky. This move is Fighting and Flying type simultaneously.,,championslab
